{"$schema":"https://json-schema.org/draft/2020-12/schema","$id":"https://upp.dev/schemas/external-qualification-plan.schema.json","title":"StageMesh external qualification plan","type":"object","required":["documentType","schemaVersion","build","tasks","physicalOutputsArmed","planId"],"properties":{"documentType":{"const":"org.upp.external-qualification-plan"},"schemaVersion":{"const":1},"planId":{"type":"string","pattern":"^sha256:[0-9a-f]{64}$"},"build":{"type":"object","required":["sourceFingerprint","nativeEngineSha256"],"properties":{"sourceFingerprint":{"type":"string","pattern":"^sha256:[0-9a-f]{64}$"},"nativeEngineSha256":{"type":"string","pattern":"^sha256:[0-9a-f]{64}$"}},"additionalProperties":false},"tasks":{"type":"array","minItems":1,"maxItems":32,"items":{"type":"object","required":["taskId","backlogIds","environment","command","requiredClaims","requiredArtifacts"],"properties":{"taskId":{"type":"string","minLength":1,"maxLength":128},"backlogIds":{"type":"array","minItems":1,"maxItems":32,"items":{"type":"string","minLength":1,"maxLength":32}},"environment":{"type":"string","minLength":1,"maxLength":512},"command":{"type":["string","null"],"maxLength":256},"requiredClaims":{"type":"array","minItems":1,"maxItems":32,"uniqueItems":true,"items":{"type":"string","minLength":1,"maxLength":128}},"requiredArtifacts":{"type":"array","minItems":1,"maxItems":16,"uniqueItems":true,"items":{"type":"string","minLength":1,"maxLength":128}}},"additionalProperties":false}},"physicalOutputsArmed":{"const":false}},"additionalProperties":false}
